{
  "schema": {
    "name": "Knowledge Area/Skill Area Unified Schema v2",
    "version": "2.0",
    "generated_at": "2025-01-15T10:30:00.000000Z",
    "source": "curriculum/cs2023/SE_SAMPLE_v2.json"
  },
  "knowledge_area": {
    "name": "Software Engineering",
    "code": "SE"
  },
  "description": "Software engineering is the discipline concerned with the application of theory, knowledge, and practice to effectively and efficiently build reliable software systems that satisfy the needs of customers and users.",
  "sections": [
    {
      "id": "se-sec-1",
      "title": "SE/Software Processes",
      "order": 1,
      "summary": "This section covers the fundamentals of software processes, including different lifecycle models like waterfall, iterative, and agile",
      "topics": [
        {
          "id": "topic-1",
          "name": "different lifecycle models like waterfall"
        },
        {
          "id": "topic-2",
          "name": "iterative"
        },
        {
          "id": "topic-3",
          "name": "and agile"
        }
      ],
      "learning_outcomes": [
        {
          "id": "lo-1",
          "text": "the ability to select and justify an appropriate software process for a given project.",
          "cognitive_level": "Apply"
        }
      ],
      "bullets": [],
      "crossrefs": [],
      "qa_flags": {},
      "source_loc": {
        "file": "SE_SAMPLE_v1.json",
        "section": 1
      },
      "subsections": []
    },
    {
      "id": "se-sec-2",
      "title": "SE/Software Design",
      "order": 2,
      "summary": "This section covers software design principles and practices",
      "topics": [
        {
          "id": "topic-4",
          "name": "design principles"
        },
        {
          "id": "topic-5",
          "name": "architecture patterns"
        }
      ],
      "learning_outcomes": [
        {
          "id": "lo-2",
          "text": "creating and documenting a software design for a medium-sized application.",
          "cognitive_level": "Apply"
        },
        {
          "id": "lo-3",
          "text": "Students will learn about concepts like coupling, cohesion, and design patterns.",
          "cognitive_level": "Understand"
        }
      ],
      "bullets": [],
      "crossrefs": [],
      "qa_flags": {},
      "source_loc": {
        "file": "SE_SAMPLE_v1.json",
        "section": 2
      },
      "subsections": []
    }
  ]
}
